{
  "form_info": {
    "carrier": "Superior Health Plan",
    "form_type": "CMS-1500 (02-12)",
    "form_number": "CR061653"
  },
  "patient_info": {
    "name": {
      "last_name": "Syed",
      "first_name": "Sirajuddin",
      "middle_initial": "",
      "full_name": "Syed Sirajuddin ahmed"
    },
    "date_of_birth": {
      "formatted": "04/15/1986",
      "month": "04",
      "day": "15",
      "year": "1986"
    },
    "sex": {
      "value": "M"
    },
    "address": {
      "street": "1345 Canyon creek cir",
      "city": "College Station",
      "state": "TX",
      "zip_code": "77840"
    },
    "telephone": {
      "formatted": "(346)-420-7140"
    },
    "relationship_to_insured": {
      "value": "Self",
      "options": ["Self", "Spouse", "Child", "Other"]
    },
    "id_number": {
      "value": "UZ167198902",
      "type": "Member ID"
    },
    "policy_group_number": {
      "value": ""
    }
  },
  "diagnosis": {
    "icd_indicator": {
      "value": "0",
      "description": "ICD-10"
    },
    "codes": [
      {
        "pointer": "A",
        "code": "I10",
        "description": ""
      },
      {
        "pointer": "B",
        "code": "E78.2",
        "description": ""
      },
      {
        "pointer": "C",
        "code": "R53.83",
        "description": ""
      },
      {
        "pointer": "D",
        "code": "T16.2XXX",
        "description": ""
      },
      {
        "pointer": "E",
        "code": "H10.11",
        "description": ""
      }
    ]
  },
  "service_lines": [
    {
      "line_number": 1,
      "dates_of_service": {
        "from": {
          "formatted": "01/20/2026",
          "month": "01",
          "day": "20",
          "year": "2026"
        },
        "to": {
          "formatted": "01/20/2026",
          "month": "01",
          "day": "20",
          "year": "2026"
        }
      },
      "place_of_service": {
        "code": "11",
        "description": "Office"
      },
      "procedure_code": {
        "code": "99204",
        "modifier": "25",
        "description": ""
      },
      "diagnosis_pointer": {
        "value": "ABCD",
        "pointers": ["A", "B", "C", "D"]
      },
      "charges": {
        "formatted": "435.00",
        "amount": 435.00,
        "currency": "USD"
      },
      "days_units": {
        "value": "1",
        "type": "UN",
        "description": "Units/Days"
      },
      "amount_paid": {
        "formatted": "0.00",
        "amount": 0.00,
        "currency": "USD"
      },
      "rendering_provider": {
        "npi": {
          "value": "1639511397"
        },
        "id": {
          "value": "",
          "qualifier": "0B"
        }
      }
    },
    {
      "line_number": 2,
      "dates_of_service": {
        "from": {
          "formatted": "01/20/2026",
          "month": "01",
          "day": "20",
          "year": "2026"
        },
        "to": {
          "formatted": "01/20/2026",
          "month": "01",
          "day": "20",
          "year": "2026"
        }
      },
      "place_of_service": {
        "code": "11",
        "description": "Office"
      },
      "procedure_code": {
        "code": "69210",
        "modifier": "59",
        "description": ""
      },
      "diagnosis_pointer": {
        "value": "D",
        "pointers": ["D"]
      },
      "charges": {
        "formatted": "120.00",
        "amount": 120.00,
        "currency": "USD"
      },
      "days_units": {
        "value": "1",
        "type": "UN",
        "description": "Units/Days"
      },
      "amount_paid": {
        "formatted": "0.00",
        "amount": 0.00,
        "currency": "USD"
      },
      "rendering_provider": {
        "npi": {
          "value": "1639511397"
        },
        "id": {
          "value": "",
          "qualifier": "0B"
        }
      }
    },
    {
      "line_number": 3,
      "dates_of_service": {
        "from": {
          "formatted": "01/20/2026",
          "month": "01",
          "day": "20",
          "year": "2026"
        },
        "to": {
          "formatted": "01/20/2026",
          "month": "01",
          "day": "20",
          "year": "2026"
        }
      },
      "place_of_service": {
        "code": "11",
        "description": "Office"
      },
      "procedure_code": {
        "code": "36415",
        "modifier": "",
        "description": ""
      },
      "diagnosis_pointer": {
        "value": "ABCD",
        "pointers": ["A", "B", "C", "D"]
      },
      "charges": {
        "formatted": "20.00",
        "amount": 20.00,
        "currency": "USD"
      },
      "days_units": {
        "value": "1",
        "type": "UN",
        "description": "Units/Days"
      },
      "amount_paid": {
        "formatted": "0.00",
        "amount": 0.00,
        "currency": "USD"
      },
      "rendering_provider": {
        "npi": {
          "value": "1639511397"
        },
        "id": {
          "value": "",
          "qualifier": "0B"
        }
      }
    }
  ],
  "billing_info": {
    "patient_account_number": {
      "value": ""
    },
    "total_charge": {
      "formatted": "575.00",
      "amount": 575.00,
      "currency": "USD"
    },
    "amount_paid": {
      "formatted": "0.00",
      "amount": 0.00,
      "currency": "USD"
    },
    "balance_due": {
      "formatted": "575.00",
      "amount": 575.00,
      "currency": "USD"
    }
  }
}
