{
  "form_info": {
    "carrier": "Superior Health Plan",
    "form_type": "CMS-1500 (02-12)",
    "form_number": "CR061653"
  },
  "patient_info": {
    "name": {
      "last_name": "Shukla",
      "first_name": "Sejal",
      "middle_initial": "",
      "full_name": "Shukla Sejal"
    },
    "date_of_birth": {
      "formatted": "11/15/1983",
      "month": "11",
      "day": "15",
      "year": "1983"
    },
    "sex": {
      "value": "F"
    },
    "address": {
      "street": "8134 Bellwick bay ct",
      "city": "Richmond",
      "state": "TX",
      "zip_code": "77407"
    },
    "telephone": {
      "formatted": "(856)-842-9006"
    },
    "relationship_to_insured": {
      "value": "Self",
      "options": ["Self", "Spouse", "Child", "Other"]
    },
    "id_number": {
      "value": "U9296098201",
      "type": "Member ID"
    },
    "policy_group_number": {
      "value": "92960982"
    }
  },
  "diagnosis": {
    "icd_indicator": {
      "value": "0",
      "description": "ICD-10"
    },
    "codes": [
      {
        "pointer": "A",
        "code": "Z00.01",
        "description": ""
      },
      {
        "pointer": "B",
        "code": "Z12.31",
        "description": ""
      },
      {
        "pointer": "C",
        "code": "Z68.35",
        "description": ""
      },
      {
        "pointer": "D",
        "code": "K11.21",
        "description": ""
      }
    ]
  },
  "service_lines": [
    {
      "line_number": 1,
      "dates_of_service": {
        "from": {
          "formatted": "11/20/2025",
          "month": "11",
          "day": "20",
          "year": "2025"
        },
        "to": {
          "formatted": "11/20/2025",
          "month": "11",
          "day": "20",
          "year": "2025"
        }
      },
      "place_of_service": {
        "code": "11",
        "description": "Office"
      },
      "procedure_code": {
        "code": "99396",
        "modifier": "",
        "description": ""
      },
      "diagnosis_pointer": {
        "value": "ABCD",
        "pointers": ["A", "B", "C", "D"]
      },
      "charges": {
        "formatted": "180.00",
        "amount": 180.00,
        "currency": "USD"
      },
      "days_units": {
        "value": "1",
        "type": "UN",
        "description": "Units/Days"
      },
      "amount_paid": {
        "formatted": "0.00",
        "amount": 0.00,
        "currency": "USD"
      },
      "rendering_provider": {
        "npi": {
          "value": "1639511397"
        },
        "id": {
          "value": "R1006",
          "qualifier": "0B"
        }
      }
    }
  ],
  "billing_info": {
    "patient_account_number": {
      "value": "PAT3311"
    },
    "total_charge": {
      "formatted": "180.00",
      "amount": 180.00,
      "currency": "USD"
    },
    "amount_paid": {
      "formatted": "0.00",
      "amount": 0.00,
      "currency": "USD"
    },
    "balance_due": {
      "formatted": "180.00",
      "amount": 180.00,
      "currency": "USD"
    }
  }
}
